{
  "$schema": "https://json-schema.org/draft/2020-12/schema",
  "type": "object",
  "additionalProperties": false,
  "required": [
    "analysis_report_plan",
    "approval",
    "approved_dossier",
    "campaign_reference",
    "coverage_counts",
    "definitive_execution_started",
    "excluded_evidence",
    "expanded_manifest_seal",
    "implementation_base",
    "job_array_spec",
    "operation_counts",
    "operation_counts_by_scope",
    "optional_order",
    "production_eligible",
    "production_profiles",
    "registered_or_private_artifacts_accessed",
    "resource_gate",
    "resource_projection",
    "schema_version",
    "scientific_data",
    "scientific_jobs_executed",
    "scientific_protocol",
    "scope_job_counts",
    "stage14_started",
    "stage15_started",
    "synthetic_fixture",
    "synthetic_report",
    "tier_job_counts"
  ],
  "properties": {
    "analysis_report_plan": {},
    "approval": {},
    "approved_dossier": {},
    "campaign_reference": {},
    "coverage_counts": {},
    "definitive_execution_started": {},
    "excluded_evidence": {},
    "expanded_manifest_seal": {},
    "implementation_base": {},
    "job_array_spec": {},
    "operation_counts": {},
    "operation_counts_by_scope": {},
    "optional_order": {},
    "production_eligible": {},
    "production_profiles": {},
    "registered_or_private_artifacts_accessed": {},
    "resource_gate": {},
    "resource_projection": {},
    "schema_version": {},
    "scientific_data": {},
    "scientific_jobs_executed": {},
    "scientific_protocol": {},
    "scope_job_counts": {},
    "stage14_started": {},
    "stage15_started": {},
    "synthetic_fixture": {},
    "synthetic_report": {},
    "tier_job_counts": {}
  }
}
